{
  "schema": "prisma.visual-promotion.canonical-promotion-plan.v1",
  "phase": "CANONICAL_PROMOTION_READINESS_RESOLUTION",
  "status": "READY_FOR_CANONICAL_PROMOTION_INTEGRATION",
  "inputCount": 2097,
  "readyExistingAuthorityReuse": 0,
  "readyCanonicalRegistration": 0,
  "blocked": 2097,
  "notApplicable": 0,
  "missingCount": 0,
  "extraCount": 0,
  "duplicateTargetIds": 0,
  "semanticMutationCount": 0,
  "safeExactReuseTargets": [],
  "safeExactRegistrationProposalKeys": [],
  "blockedTargets": [
    "TGT.CENSUS.MOBILE.00E157BB1037B15443CF.V1",
    "TGT.CENSUS.MOBILE.014ED4EA8748A17C2C93.V1",
    "TGT.CENSUS.MOBILE.02AEA20FD1E33E794D5A.V1",
    "TGT.CENSUS.MOBILE.04470A2AD4333298ECB9.V1",
    "TGT.CENSUS.MOBILE.04C2E4B11E9BD2164ECE.V1",
    "TGT.CENSUS.MOBILE.04C78E372480E9F715A0.V1",
    "TGT.CENSUS.MOBILE.0709FD0252505394FE90.V1",
    "TGT.CENSUS.MOBILE.0744B118EA271B72A0F0.V1",
    "TGT.CENSUS.MOBILE.0896F7B7C84C5436F96E.V1",
    "TGT.CENSUS.MOBILE.090B5846F0720F959519.V1",
    "TGT.CENSUS.MOBILE.0941792D13E24F4480EC.V1",
    "TGT.CENSUS.MOBILE.097E8CC0171DE9FD901F.V1",
    "TGT.CENSUS.MOBILE.0F7C37E639F6CDE90D95.V1",
    "TGT.CENSUS.MOBILE.0FE7EC35445C40FAB557.V1",
    "TGT.CENSUS.MOBILE.1080D5C1C7126C952559.V1",
    "TGT.CENSUS.MOBILE.112769F2D05122BC61EB.V1",
    "TGT.CENSUS.MOBILE.13E230F8B1844FEDE3BA.V1",
    "TGT.CENSUS.MOBILE.143F4CC249BD7B47222F.V1",
    "TGT.CENSUS.MOBILE.199CA95522BD89BF8416.V1",
    "TGT.CENSUS.MOBILE.1A1C7AFD707FEEF5CE64.V1",
    "TGT.CENSUS.MOBILE.1A6921471557A68EE390.V1",
    "TGT.CENSUS.MOBILE.1C1E9F528024A7E2D5D3.V1",
    "TGT.CENSUS.MOBILE.1CA67A32502906943740.V1",
    "TGT.CENSUS.MOBILE.1E79A337678DF6C7B692.V1",
    "TGT.CENSUS.MOBILE.1EDA4955AE5F71C2B0ED.V1",
    "TGT.CENSUS.MOBILE.1FB4A9852DD79D8F7E12.V1",
    "TGT.CENSUS.MOBILE.209FBF2415DE4CA96E74.V1",
    "TGT.CENSUS.MOBILE.21AFEB922D1DC1BC0A16.V1",
    "TGT.CENSUS.MOBILE.221CE3F8C2894BA034F7.V1",
    "TGT.CENSUS.MOBILE.2542307CD2CF1AAA72A4.V1",
    "TGT.CENSUS.MOBILE.2567B3D9ABD40F692CFA.V1",
    "TGT.CENSUS.MOBILE.2708630BDCDE59259BE3.V1",
    "TGT.CENSUS.MOBILE.2714E01A6363FF63C448.V1",
    "TGT.CENSUS.MOBILE.2795A01B5B3EA96494B0.V1",
    "TGT.CENSUS.MOBILE.27A06F4E7A9EF41D60DC.V1",
    "TGT.CENSUS.MOBILE.29EE025A1969C05DDAF5.V1",
    "TGT.CENSUS.MOBILE.2A23C19A193051955E35.V1",
    "TGT.CENSUS.MOBILE.2ADC3BF64F9DA2198378.V1",
    "TGT.CENSUS.MOBILE.2ED5F81B18A31B8EE2B5.V1",
    "TGT.CENSUS.MOBILE.2FF029CBB94D96A6357E.V1",
    "TGT.CENSUS.MOBILE.311FEEDF1500A78E3304.V1",
    "TGT.CENSUS.MOBILE.32B8A71FB6CB2254A92C.V1",
    "TGT.CENSUS.MOBILE.32CB38978EE1BA0D21F4.V1",
    "TGT.CENSUS.MOBILE.32F55EF7DE4801CAA57F.V1",
    "TGT.CENSUS.MOBILE.350E3E090A32AF988989.V1",
    "TGT.CENSUS.MOBILE.369522022EB96FED2360.V1",
    "TGT.CENSUS.MOBILE.37237308DDF6C9C8BB84.V1",
    "TGT.CENSUS.MOBILE.375E36873E3C8B4BD17F.V1",
    "TGT.CENSUS.MOBILE.38655CCEA6A8AAFCD14F.V1",
    "TGT.CENSUS.MOBILE.38FDD9373B124F2E5FB2.V1",
    "TGT.CENSUS.MOBILE.3A01C1EBE1CBBF990274.V1",
    "TGT.CENSUS.MOBILE.3BD86C2D8B4EFA4CE6E1.V1",
    "TGT.CENSUS.MOBILE.3EC69DE308DE1EBA02BF.V1",
    "TGT.CENSUS.MOBILE.3F10C90241E3BB72864C.V1",
    "TGT.CENSUS.MOBILE.3F37C9860F0752D6A5AC.V1",
    "TGT.CENSUS.MOBILE.3F89CE9EEB8A5556A37A.V1",
    "TGT.CENSUS.MOBILE.4070B9AD3BEF4F3D1F17.V1",
    "TGT.CENSUS.MOBILE.4167201ADFC0045FBBDC.V1",
    "TGT.CENSUS.MOBILE.41B8F2E0D92259B55D03.V1",
    "TGT.CENSUS.MOBILE.41BE57A637654C1FEB7B.V1",
    "TGT.CENSUS.MOBILE.430192A4A9FA1F82ED8D.V1",
    "TGT.CENSUS.MOBILE.451E88F0CE6A9B9282DB.V1",
    "TGT.CENSUS.MOBILE.45B10213555651096FE1.V1",
    "TGT.CENSUS.MOBILE.4764BEA65E75DB9BC9C3.V1",
    "TGT.CENSUS.MOBILE.4786A66D8D099AD038A9.V1",
    "TGT.CENSUS.MOBILE.480C0A9F3C23BC19A5A1.V1",
    "TGT.CENSUS.MOBILE.48B081743A696D54FA49.V1",
    "TGT.CENSUS.MOBILE.48C69E1D2A34210843BB.V1",
    "TGT.CENSUS.MOBILE.4BDC49AE0D0F3C074651.V1",
    "TGT.CENSUS.MOBILE.4CCDB622D799306D57B1.V1",
    "TGT.CENSUS.MOBILE.4D56BC6413005FBB0494.V1",
    "TGT.CENSUS.MOBILE.4E78FBC22868F2CEB2AF.V1",
    "TGT.CENSUS.MOBILE.4E830EBE121381A46EE4.V1",
    "TGT.CENSUS.MOBILE.4E932CEA4474AA4E623C.V1",
    "TGT.CENSUS.MOBILE.4E9A74594AE8F1CD9872.V1",
    "TGT.CENSUS.MOBILE.503651512C112A8033E4.V1",
    "TGT.CENSUS.MOBILE.50C141807ED469B9541A.V1",
    "TGT.CENSUS.MOBILE.50D682C53228D9FC9149.V1",
    "TGT.CENSUS.MOBILE.50E0AD051AC066BC4161.V1",
    "TGT.CENSUS.MOBILE.514E35CD0EE41605198A.V1",
    "TGT.CENSUS.MOBILE.523EF1B7E1AB200737BC.V1",
    "TGT.CENSUS.MOBILE.53B5CF5049B41E1F7E4F.V1",
    "TGT.CENSUS.MOBILE.5410606FF23B20505DA0.V1",
    "TGT.CENSUS.MOBILE.54289E9B2696EB8DFC13.V1",
    "TGT.CENSUS.MOBILE.547D5562A528B3D6F53A.V1",
    "TGT.CENSUS.MOBILE.54D2D2BD32C1B8C66D33.V1",
    "TGT.CENSUS.MOBILE.55008D69041745B7422F.V1",
    "TGT.CENSUS.MOBILE.550C34457BA7CDF1D332.V1",
    "TGT.CENSUS.MOBILE.56017A0480B3DA8DF4FD.V1",
    "TGT.CENSUS.MOBILE.561B4D92642397C84AEA.V1",
    "TGT.CENSUS.MOBILE.5661F9918BD7AE3AF3F4.V1",
    "TGT.CENSUS.MOBILE.57F1B405341D51033C68.V1",
    "TGT.CENSUS.MOBILE.59278221FDABC63B8CA1.V1",
    "TGT.CENSUS.MOBILE.59AD393D1846159F6D4B.V1",
    "TGT.CENSUS.MOBILE.5A4F69FC6E27507B0684.V1",
    "TGT.CENSUS.MOBILE.5A73D70F05EA38CAD0C2.V1",
    "TGT.CENSUS.MOBILE.5A91D8A60D75574AE694.V1",
    "TGT.CENSUS.MOBILE.5AF65816D6C696B32921.V1",
    "TGT.CENSUS.MOBILE.5D5F46806FF69CE9EA73.V1",
    "TGT.CENSUS.MOBILE.5D863422BB4C0AF5E7E9.V1",
    "TGT.CENSUS.MOBILE.5E573A3D300EFF1D5868.V1",
    "TGT.CENSUS.MOBILE.60047125F72A00435AF9.V1",
    "TGT.CENSUS.MOBILE.6078AA90804FBAC19154.V1",
    "TGT.CENSUS.MOBILE.6080328B89BEF98C88D8.V1",
    "TGT.CENSUS.MOBILE.60C10BDA0FFEDF74C897.V1",
    "TGT.CENSUS.MOBILE.6108B44065B36803BA7F.V1",
    "TGT.CENSUS.MOBILE.62E5008C64B9B69FA3B7.V1",
    "TGT.CENSUS.MOBILE.63534F8953A164128FD9.V1",
    "TGT.CENSUS.MOBILE.6360DB4BEA2859116416.V1",
    "TGT.CENSUS.MOBILE.63CE42C6B29C4B9957AE.V1",
    "TGT.CENSUS.MOBILE.656EE58F5BFCFFA0D1F1.V1",
    "TGT.CENSUS.MOBILE.65C7B6468CFAA015B8F6.V1",
    "TGT.CENSUS.MOBILE.66843CA22B3C72A8C549.V1",
    "TGT.CENSUS.MOBILE.67DA422E864AD178DB82.V1",
    "TGT.CENSUS.MOBILE.6864F7FAA8D5E25FB92D.V1",
    "TGT.CENSUS.MOBILE.6A0F665645DD3CB8F9FD.V1",
    "TGT.CENSUS.MOBILE.6A80A7144ADE50A701EA.V1",
    "TGT.CENSUS.MOBILE.6A9D8420415515651B8A.V1",
    "TGT.CENSUS.MOBILE.6D238649031BA55F8CDF.V1",
    "TGT.CENSUS.MOBILE.6EF45593DF49E8BFB813.V1",
    "TGT.CENSUS.MOBILE.705A4C7CC68C5D29B621.V1",
    "TGT.CENSUS.MOBILE.714B5F77454227EFC6F0.V1",
    "TGT.CENSUS.MOBILE.714C048021A2BACF360D.V1",
    "TGT.CENSUS.MOBILE.72717D603DB9D6DFC19D.V1",
    "TGT.CENSUS.MOBILE.736A57E4ADF199549F6C.V1",
    "TGT.CENSUS.MOBILE.73A58AB5149E12A24182.V1",
    "TGT.CENSUS.MOBILE.73F4444558EA887BA694.V1",
    "TGT.CENSUS.MOBILE.74373711B7C779EB1239.V1",
    "TGT.CENSUS.MOBILE.75BA65BD0F335D3D48F7.V1",
    "TGT.CENSUS.MOBILE.762A93D9FAED949C27DE.V1",
    "TGT.CENSUS.MOBILE.771476EA05867CF86F0B.V1",
    "TGT.CENSUS.MOBILE.77A6E0567D2179DB5B4C.V1",
    "TGT.CENSUS.MOBILE.791DB372317DD576D66E.V1",
    "TGT.CENSUS.MOBILE.79B24C2B6FC93C8318FE.V1",
    "TGT.CENSUS.MOBILE.7A19F06A126E18323D99.V1",
    "TGT.CENSUS.MOBILE.7AE9B37D828721CB990F.V1",
    "TGT.CENSUS.MOBILE.7BEB6609E78E7EEAEE8C.V1",
    "TGT.CENSUS.MOBILE.7C3E4F105D8BD9CF5085.V1",
    "TGT.CENSUS.MOBILE.7CD92AC7C2461E704B54.V1",
    "TGT.CENSUS.MOBILE.7F43F27BDA0DA25C4F24.V1",
    "TGT.CENSUS.MOBILE.803C1397E1F2DECC529A.V1",
    "TGT.CENSUS.MOBILE.807CF9C2B08B27467D7A.V1",
    "TGT.CENSUS.MOBILE.82C55418E03BBC6A5CB0.V1",
    "TGT.CENSUS.MOBILE.8309FF02195EF64A8DFF.V1",
    "TGT.CENSUS.MOBILE.84DBDD365E3E54231269.V1",
    "TGT.CENSUS.MOBILE.89AF7FD01E68492F1543.V1",
    "TGT.CENSUS.MOBILE.8A4C24D4A49A1FA1FE11.V1",
    "TGT.CENSUS.MOBILE.8A52B263507DCA224BD1.V1",
    "TGT.CENSUS.MOBILE.8A92D375B6B10BD8355C.V1",
    "TGT.CENSUS.MOBILE.8B0D36C64EA3050A9984.V1",
    "TGT.CENSUS.MOBILE.8B8C30DCAD293EA85DD7.V1",
    "TGT.CENSUS.MOBILE.8C02DAB195A906C8E6C4.V1",
    "TGT.CENSUS.MOBILE.8D2EFE87347A76A0F735.V1",
    "TGT.CENSUS.MOBILE.8F7A3B6F533E3C1CA7FE.V1",
    "TGT.CENSUS.MOBILE.8FC17190D6EB7D004FCE.V1",
    "TGT.CENSUS.MOBILE.91B96B39D7DEDB5E2D32.V1",
    "TGT.CENSUS.MOBILE.92DE07E558D4AE7E11C7.V1",
    "TGT.CENSUS.MOBILE.944F2AD855CF4AEB3B4D.V1",
    "TGT.CENSUS.MOBILE.94B3075F2D66B72EE1C9.V1",
    "TGT.CENSUS.MOBILE.95353577C26D9E35FB91.V1",
    "TGT.CENSUS.MOBILE.95493574BA498F8D6CBB.V1",
    "TGT.CENSUS.MOBILE.9B3E30B44A30FD04BD21.V1",
    "TGT.CENSUS.MOBILE.9B4EDB3D1604D6FEE96D.V1",
    "TGT.CENSUS.MOBILE.9C430875D7D6E8EBC243.V1",
    "TGT.CENSUS.MOBILE.9D658D73114F3D344409.V1",
    "TGT.CENSUS.MOBILE.9DD3FD15FA156CF996EA.V1",
    "TGT.CENSUS.MOBILE.9E9AD94E49E18E8EF8CA.V1",
    "TGT.CENSUS.MOBILE.9EA8A561E5CDE7706B8E.V1",
    "TGT.CENSUS.MOBILE.9EB5FB6399D47C73693D.V1",
    "TGT.CENSUS.MOBILE.A03D7240010E6E736AD8.V1",
    "TGT.CENSUS.MOBILE.A03DB7ED5507B8072014.V1",
    "TGT.CENSUS.MOBILE.A04F7194439B360F2329.V1",
    "TGT.CENSUS.MOBILE.A16441F6C8923F86C0EC.V1",
    "TGT.CENSUS.MOBILE.A1F22518605A42515FB5.V1",
    "TGT.CENSUS.MOBILE.A33F24F732E9E0F776A7.V1",
    "TGT.CENSUS.MOBILE.A4C8CF2E0DA027133951.V1",
    "TGT.CENSUS.MOBILE.A740B58DD6CE6F8797A0.V1",
    "TGT.CENSUS.MOBILE.A8BDDDDDE576F9CFD437.V1",
    "TGT.CENSUS.MOBILE.A95BFE8596CDDE2F27DB.V1",
    "TGT.CENSUS.MOBILE.AAB2E248E4AFB10058D6.V1",
    "TGT.CENSUS.MOBILE.AB2CE34508F372F34A22.V1",
    "TGT.CENSUS.MOBILE.AE825FE1E7C4616169FA.V1",
    "TGT.CENSUS.MOBILE.AEC52916FD5CB5CA9491.V1",
    "TGT.CENSUS.MOBILE.AEE118BA7C1D0F7C0F4D.V1",
    "TGT.CENSUS.MOBILE.B1037DAD2AD114D8C819.V1",
    "TGT.CENSUS.MOBILE.B2BFE2E191D24D27AC60.V1",
    "TGT.CENSUS.MOBILE.B3236353E49FDCEDC51F.V1",
    "TGT.CENSUS.MOBILE.B43F32AD15983700E99B.V1",
    "TGT.CENSUS.MOBILE.B467E343BFCAD994E3F8.V1",
    "TGT.CENSUS.MOBILE.B6716130C45C40460CF3.V1",
    "TGT.CENSUS.MOBILE.B674D806C6616D4C1F2F.V1",
    "TGT.CENSUS.MOBILE.B6D368C27A8FFC4E5B75.V1",
    "TGT.CENSUS.MOBILE.B7541A07AF513BA4A343.V1",